<!ELEMENT catalog (book+)>
<!ELEMENT book (title,author,genre,price,availability)>
<!ELEMENT title (#PCDATA)>
<!ELEMENT author (#PCDATA)>
<!ELEMENT genre (#PCDATA)>
<!ELEMENT price (#PCDATA)>
<!ELEMENT availability (#PCDATA)>